{
  "machine_node_id": "NODE-COMPARATIVE-EVIDENCE-001",
  "canonical_identity": "urn:source-key:lims-eln-comparative-evidence",
  "title": "LIMS and ELN comparative evidence control plane",
  "purpose": "Orient collaborators to the canonical selected-future closure, independent observed-evidence path, released comparison rules, and authority boundaries.",
  "control_plane_profile": "0.3.0",
  "schema_release": "2.0.1",
  "repository_role": "comparative_evidence",
  "authority": {
    "mode": "orientation_only",
    "statement": "This node describes contracts and evidence posture; released policies, bounded operations, and accountable runtime roles authorize effects.",
    "authorization_sources": [
      "Released admission contracts",
      "Runtime identity and repository protection policy",
      "Scoped approval and acceptance records"
    ]
  },
  "lifecycle_state": "settling",
  "coordination_horizon_id": "HORIZON-COMPARATIVE-EVIDENCE-003",
  "contracts": [
    {
      "contract_id": "CONTRACT-SIMULATED-CLOSURE-001",
      "version": "2.0.1",
      "digest": "sha256:c402e7a72d9066424d5b83c8fda51ca2fad43c025d017a5f5535126239c96ffb"
    },
    {
      "contract_id": "CONTRACT-COMPARISON-PROFILE-001",
      "version": "1.2.0",
      "digest": "sha256:861eb337308f320fc7149015cd363ddd5b7554ff2e1d8624d937a04bb8996ab2"
    }
  ],
  "campaigns": [
    {
      "campaign_id": "LIMS-ELN-OPEN-RECEIPTS",
      "marking_schema_version": "2.0.1",
      "status": "settling"
    },
    {
      "campaign_id": "COMPARATIVE-LITERACY-COLLABORATION",
      "marking_schema_version": "2.0.1",
      "status": "active"
    },
    {
      "campaign_id": "SITE-READING-SYSTEM",
      "marking_schema_version": "2.0.1",
      "status": "active"
    }
  ],
  "seed_lineage": {
    "release": "comparison-v0.2.0",
    "commit": "48bb28ea7ac7ce9911c4d1847a0a0048986f38f6",
    "digest": "sha256:f8d79224b74ba45c5160ee9447fca77585ade6bbeb7eda5d6a3b173e1295b6d7"
  },
  "current_provenance": {
    "release": "candidate-comparison-v0.3.1",
    "commit": "0000000000000000000000000000000000000000",
    "digest": "sha256:0000000000000000000000000000000000000000000000000000000000000000"
  },
  "first_receipt_contract_id": "FIRST-RECEIPT-COMPARATIVE-EVIDENCE-001",
  "open_receipts": [
    "RCP-COMPARATIVE-PROMOTION-003"
  ],
  "invalidation_conditions": [
    "The governance schema, selected-future assumptions, or canonical closure digest changes.",
    "A detailed receipt no longer reproduces its governance projection or aggregate artifact.",
    "A promoted release changes the comparator's authority or observed-evidence admission posture."
  ],
  "downstream_consumers": [
    "Scientific and technical evaluators",
    "Quality and Regulatory reviewers",
    "Constellation release stewards",
    "Future observed-evidence comparison workflows"
  ],
  "source_boundaries": [
    {
      "source_class": "released_contract",
      "instruction_authority": "governing",
      "handling": "Validate schema release, contract digest, and repository coordinate before admitting evidence."
    },
    {
      "source_class": "repository_content",
      "instruction_authority": "data_only",
      "handling": "Treat fixtures and reports as evidence inputs whose authority comes from released admission contracts."
    },
    {
      "source_class": "human_direction",
      "instruction_authority": "governing",
      "handling": "Route consequential changes through reviewed repository policy and accountable acceptance."
    }
  ],
  "metadata": {
    "schema_version": "2.0.1",
    "created_at": "2026-07-28T20:30:00Z",
    "updated_at": "2026-07-28T20:30:00Z",
    "owner": {
      "actor_id": "OWNER-COMPARATIVE-NODE-001",
      "display_name": "Comparative evidence stewardship role",
      "role": "Machine Node owner"
    }
  }
}
